{
  "action_id": "dispatch-39a2673646933b53d0b0fa39",
  "agent_id": "/root/host_bridge/v6_d8324e377f8d67ed52a88c10",
  "batch": 2,
  "dispatch_id": "dispatch-39a2673646933b53d0b0fa39",
  "error": null,
  "host": "codex",
  "host_call_id": null,
  "host_tool": "collaboration.spawn_agent",
  "observed_at": "2026-09-25T12:58:31.570188Z",
  "result_uri": null,
  "schema": "dispatch-receipt/6.0",
  "sent_at": "2026-09-25T12:58:31.570188Z",
  "status": "RUNNING",
  "task_digest": "4dbba2cda3a38f27e377ef7baef3c453111cdae3b93e58d6e2b925f36937c6c4",
  "task_id": "TASK_3240f8bc6a9896032b95d091",
  "tool_result_sha256": "bf681aec3b88bac39191aa86902eccb9435bece594ea261cf162f5ce88769f13",
  "tool_result_uri": "runtime/v6/host-evidence/bf681aec3b88bac39191aa86902eccb9435bece594ea261cf162f5ce88769f13.json"
}
